{
  "$ref": "#/definitions/workJobs",
  "definitions": {
    "workJobs": {
      "type": "object",
      "properties": {
        "title": {
          "type": "string"
        },
        "company": {
          "type": "string"
        },
        "description": {
          "type": "string"
        },
        "highlights": {
          "type": "array",
          "items": {
            "type": "string"
          }
        },
        "startDate": {
          "anyOf": [
            {
              "type": "string",
              "format": "date-time"
            },
            {
              "type": "string",
              "format": "date"
            },
            {
              "type": "integer",
              "format": "unix-time"
            }
          ]
        },
        "endDate": {
          "anyOf": [
            {
              "type": "string",
              "format": "date-time"
            },
            {
              "type": "string",
              "format": "date"
            },
            {
              "type": "integer",
              "format": "unix-time"
            }
          ]
        },
        "workSkills": {
          "type": "array",
          "items": {
            "type": "string"
          }
        },
        "isCurrentJob": {
          "type": "boolean",
          "default": false
        },
        "$schema": {
          "type": "string"
        }
      },
      "required": [
        "title",
        "company",
        "startDate"
      ],
      "additionalProperties": false
    }
  },
  "$schema": "http://json-schema.org/draft-07/schema#"
}