{
  "title": "Lead Front-End Developer",
  "company": "downstream",
  "description": "Led front-end development efforts for a CMS revision project, utilizing Typescript, Vue 3, and Tailwind CSS to improve user experience and streamline workflows",
  "highlights": [
    "Led front-end development efforts for a CMS revision project, utilizing Typescript, Vue 3, and Tailwind CSS to improve user experience and streamline workflows",
    "Worked collaboratively with back-end team to ensure seamless integration of front-end and back-end systems, ensuring data consistency and reliability",
    "Demonstrated proficiency in understanding Rust code and the ability to translate it into practical front-end solutions",
    "Successfully delivered high-quality code that met project timelines and exceeded client expectations, resulting in a more efficient and user-friendly CMS"
  ],
  "startDate": "2021-12-31",
  "endDate": "2022-08-01",
  "isCurrentJob": false
}