{
  "title": "Full-Stack Software Engineer",
  "company": "deeplocal",
  "description": "Built features for Gumband (TypeScript/React/Node), prototyped a Python↔TouchDesigner SDK integration, and improved delivery velocity for large installations.",
  "highlights": [
    "Led a proof of concept to merge a Python SDK with TouchDesigner, directly influencing our product roadmap and opening new business development opportunities",
    "Spearheaded a culture of pragmatic coding and iterative reviews, ensuring our team could quickly adapt to new challenges without sacrificing code quality",
    "Encouraged open, platform-specific communication—Slack for chats, Jira for tasks, Figma for design—to keep our cross-functional team in sync and productive",
    "Drawing on my experiences at multiple experiential agencies—where I worked directly with software administrators, content managers, and developers—I regularly proposed user-focused features and innovative ways of integrating Gumband with our clients' installations, ensuring faster rollouts, cost-effective solutions, and a better overall user experience"
  ],
  "startDate": "2024-01-01",
  "endDate": "2025-03-01",
  "workSkills": [
    "typescript",
    "react",
    "node",
    "express",
    "postgresql",
    "javascript",
    "vite",
    "redux",
    "mui",
    "storybook",
    "sequelize",
    "css",
    "docker",
    "git",
    "html",
    "python",
    "figma"
  ],
  "isCurrentJob": false
}
