{
  "title": "Freelance Full-Stack Developer",
  "company": "bracket-bear",
  "description": "Freelance role delivering tailored web solutions for various clients",
  "highlights": [
    "Delivered tailored web solutions to clients, ranging from enterprise-level to small businesses, enhancing their system capabilities and user experience",
    "Managed end-to-end client relationships, from initial outreach and proposal drafting to project delivery and post-project support",
    "Continuously updated technical skills and tools to stay abreast of industry trends and best practices, including mastering generative AI tools such as ChatGPT, ensuring the delivery of cutting-edge solutions to clients"
  ],
  "startDate": "2023-04-01",
  "endDate": "2023-12-12",
  "isCurrentJob": false,
  "workSkills": [
    "react",
    "typescript",
    "laravel",
    "node",
    "php",
    "mysql",
    "docker",
    "git",
    "tailwind-css",
    "css",
    "html"
  ]
}
