{
  "title": "Social Media Manager and Web Developer",
  "company": "north-country-brewing-co",
  "description": "Redesigned and developed the company website, resulting in a 24% increase in website visits and improved user engagement",
  "highlights": [
    "Redesigned and developed the company website, resulting in a 24% increase in website visits and improved user engagement",
    "Developed and executed a focused social media marketing strategy, leading to a 408% increase in total page likes on Facebook and increased brand awareness",
    "Worked closely with the Director of Operations to increase event turnout and drive sales, resulting in improved revenue streams and overall company growth",
    "Created custom plugins for WordPress, tailoring the website's functionality to meet specific business needs and improving user experience"
  ],
  "startDate": "2012-11-01",
  "endDate": "2016-01-01",
  "isCurrentJob": false
}