{
  "title": "Full Stack Web Developer (JavaScript/PHP) - CMS",
  "company": "downstream",
  "description": "Bridged the gap between the CMS and experience teams by being the first team member to work on both",
  "highlights": [
    "Bridged the gap between the CMS and experience teams by being the first team member to work on both",
    "Successfully contributed to the development of three generations of CMS frameworks, ensuring the platforms' stability and longevity",
    "Demonstrated strong teamwork skills by collaborating with design, UX, and account management teams to gather user feedback and implement UI/UX improvements, leading to an overall improved user experience",
    "Effectively represented Downstream in product demonstrations with clients in the USA, Amsterdam, and England, showcasing our platform's capabilities and building strong client relationships"
  ],
  "startDate": "2020-01-01",
  "endDate": "2021-12-01",
  "isCurrentJob": false
}