{
  "title": "Experience Developer",
  "company": "downstream",
  "description": "Developed interactive application installments, providing unique and engaging experiences for partners and resulting in increased engagement and user satisfaction",
  "highlights": [
    "Developed interactive application installments, providing unique and engaging experiences for partners and resulting in increased engagement and user satisfaction",
    "Collaborated with other experience developers to improve and expand features in the in-house framework, DS Cinder, resulting in a more robust and efficient development process",
    "Successfully managed remote installs for clients all over the world during the COVID-19 pandemic, demonstrating adaptability and effective communication skills",
    "Provided expert guidance to experience developers on data handling and communication between applications and CMS, resulting in improved efficiency and accuracy of data exchange",
    "Presented numerous products to client executives and stakeholders, effectively communicating complex technical concepts and building strong client relationships",
    "Demonstrated a strong commitment to ongoing learning and development, staying up to date on the latest technologies and best practices in application development"
  ],
  "startDate": "2020-07-01",
  "endDate": "2021-12-01",
  "workSkills": [
    "vue",
    "mysql",
    "php",
    "git",
    "javascript",
    "html",
    "css",
    "c-plus-plus",
    "illustrator",
    "photoshop"
  ],
  "isCurrentJob": false
}
